ID,Posted at,Screen name,Text
523970025410273281,2014-10-19 22:52:43 +0000,Ultiworldlive,"Fittingly, Gibson finds Mickle. Johnny Bravo are champs for the first time ever. 13-11 your final."
523968927337291776,2014-10-19 22:48:21 +0000,Ultiworldlive,Neff over the top to Garcia. Bravo 12-11 Ironside. Game point o for Bravo
523968140498460672,2014-10-19 22:45:14 +0000,Ultiworldlive,Pure d-line out there for Bravo.
523967951255642113,2014-10-19 22:44:29 +0000,Ultiworldlive,Smith scores from Mickle. Bravo 12-10 Ironside
523967212185743360,2014-10-19 22:41:32 +0000,Ultiworldlive,Bravo with it on the goal line. Brodie on the cone.
523966589952348160,2014-10-19 22:39:04 +0000,Ultiworldlive,Stubbs to Foster for the goal. Pretty throw. Bravo 11-10 Ironside
523965957870346240,2014-10-19 22:36:33 +0000,Ultiworldlive,"RT @kdubsultimate: If we are going to cap every game, why not make them timed? Easier for fans to understand. @USAUltimate"
523965497919148033,2014-10-19 22:34:44 +0000,Ultiworldlive,Forshee scoober for Lance into the endzone. Bravo 11-9 Ironside. Soft cap is on. Game to 13
523964833168101376,2014-10-19 22:32:05 +0000,Ultiworldlive,Lokke with a d for Bravo
523964688334598145,2014-10-19 22:31:31 +0000,Ultiworldlive,Muffin with the disc at the brick.
523964156786270208,2014-10-19 22:29:24 +0000,Ultiworldlive,"Farrell with a blade for Keegan and Bravo finish out this long. But, there's another stoppage. The score stands. Bravo 10-9 Ironside."
523963661929697280,2014-10-19 22:27:26 +0000,Ultiworldlive,Gibson gets a run through.
523963241442316289,2014-10-19 22:25:46 +0000,Ultiworldlive,"Herscu off, Cricket on for Ironside."
523963140468654081,2014-10-19 22:25:22 +0000,Ultiworldlive,Watson misses Kloor. Kloor injured. Mcshane comes in.
523962913393221632,2014-10-19 22:24:27 +0000,Ultiworldlive,Stubbs misses on the break chance. Bravo O with another shot to hold.
523961774006349825,2014-10-19 22:19:56 +0000,Ultiworldlive,Cricket scores for Ironside. Bravo 9-9 Ironside
523960855692869633,2014-10-19 22:16:17 +0000,Ultiworldlive,Brodie scores from Gibson. Bravo 9-8 Ironside
523959792331919360,2014-10-19 22:12:03 +0000,Ultiworldlive,Bravo take a timeout to give their o line a break.
523959703039377409,2014-10-19 22:11:42 +0000,Ultiworldlive,Gibson saves the point with the tip. Bravo trying to get a hold.
523959388474978305,2014-10-19 22:10:27 +0000,Ultiworldlive,Mickle turns it over.
523959343579160576,2014-10-19 22:10:16 +0000,Ultiworldlive,Wallack comes in for John Stubbs as Ironside look to break. Stubbs special to Babbitt gets block by Morgan.
523958277424418817,2014-10-19 22:06:02 +0000,Ultiworldlive,Muffin to Piers for the score. Ironside 8-8 Bravo #nationalsTX
523957902806368256,2014-10-19 22:04:33 +0000,Ultiworldlive,Bravo give it back. Muffin with the disc.
523957596093706241,2014-10-19 22:03:20 +0000,Ultiworldlive,Ryan Farrell with a bidding block.
523956271167602688,2014-10-19 21:58:04 +0000,Ultiworldlive,...or if McCarthy sent them on to give his offense some help on the turn.
523956115194015746,2014-10-19 21:57:27 +0000,Ultiworldlive,Krier said last night that Bravo was looking to force GOAT to mix up their lines.  Not sure if Stubbs and Babbitt switch was purposeful...
523955474266607617,2014-10-19 21:54:54 +0000,Ultiworldlive,"Mickle and Gibson joining Lance there on that D point, with Kloor coming in on the injury sub. Krier using his offense to convert the break."
523955187195846656,2014-10-19 21:53:45 +0000,Ultiworldlive,Gibson scores from Lance. Lance and Mickle just took over for Bravo's offense there. Bravo 8-7 Ironside. That's the half. #NationalsTX
523953746842488834,2014-10-19 21:48:02 +0000,Ultiworldlive,Watson to Ackley for the score. Ironside 7-7 Bravo. Bravo calls timeout here and will come out looking to get the second break back for half
523952989791617024,2014-10-19 21:45:02 +0000,Ultiworldlive,Stubbs and Babbitt were both on the o line for that last point. They both return for this d point for Ironside.
523952724833222657,2014-10-19 21:43:58 +0000,Ultiworldlive,Stubbs for Foster in the endzone. Ironside 7-6 Bravo.
523952084946022400,2014-10-19 21:41:26 +0000,Ultiworldlive,Bravo D get it back and Peterson makes an appearance in the endzone on the end of the McShane hammer. Ironside 6-6 Bravo.
523950900793319424,2014-10-19 21:36:43 +0000,Ultiworldlive,Hank Conker bodies up for the D and McShane calls timeout. Bravo looking to get one of the two breaks back.
523950072279859200,2014-10-19 21:33:26 +0000,Ultiworldlive,Watson to Kloor. Ironside 6-5 Bravo.
523949594083094530,2014-10-19 21:31:32 +0000,Ultiworldlive,Muffin finds Brian Garcia for the score. Ironside 6-4 Bravo
523949389749157888,2014-10-19 21:30:43 +0000,Ultiworldlive,Lance gets the D but Danny Clark snags it back
523949082419945473,2014-10-19 21:29:30 +0000,Ultiworldlive,Mickle to R. Farrell for the score. Ironside 5-4 Bravo.
523948329152299008,2014-10-19 21:26:30 +0000,Ultiworldlive,Ironside BREAK. Wallack to Simmons. Ironside 2/2 on break chances. Ironside 5-3 Bravo
523947981218017280,2014-10-19 21:25:07 +0000,Ultiworldlive,Keegan overthrows Gibson. Turnover.
523947702682652672,2014-10-19 21:24:01 +0000,Ultiworldlive,"Rebholz to Cricket for the score. Ironside in control so far, but Bravo not far away. Ironside 4-3 Bravo"
523946937004077056,2014-10-19 21:20:58 +0000,Ultiworldlive,Smith to Gibson for the goal. Ironside 3-3 Bravo
523946785086377985,2014-10-19 21:20:22 +0000,Ultiworldlive,Babbitt shaking his head as he listens to Brodie. Upheld.
523946649174155264,2014-10-19 21:19:50 +0000,Ultiworldlive,Babbitt Ds up Brodie. We have a call.
523946073203933184,2014-10-19 21:17:32 +0000,Ultiworldlive,Easy Ironside O. Cricket slings one in for Danny Clark. Ironside 3-2 Bravo.
523945523670450176,2014-10-19 21:15:21 +0000,Ultiworldlive,Gibson finds Mickle. Ironside 2-2 Bravo.
523945003715158016,2014-10-19 21:13:17 +0000,Ultiworldlive,Mickle floats a huck too high and Stubbs with a counterstike to Babbitt. Break for Ironside. Ironside 2-1 Bravo
523944452516503552,2014-10-19 21:11:06 +0000,Ultiworldlive,Kapinos was a huge presence on offense yesterday against Ring.
523944357591007232,2014-10-19 21:10:43 +0000,Ultiworldlive,"For those keeping track, Ironside's Alex Kapinos is on crutches on the sideline."
523944201487396864,2014-10-19 21:10:06 +0000,Ultiworldlive,Muffin goes full field from a standstill to find Neff. Neff snags the assist. 1-1
523943848935182337,2014-10-19 21:08:42 +0000,Ultiworldlive,"To open the game, we see Mickle leap up and sky for the point. Bravo 1-0 Ironside"
523932617134325760,2014-10-19 20:24:04 +0000,Ultiworldlive,Johnston dishes to White on the move and Scandal take the game. Final score Scandal 12-10 Fury #nationalsTX
523932292948180992,2014-10-19 20:22:47 +0000,Ultiworldlive,Disc goes back Mercier.
523932148487970816,2014-10-19 20:22:13 +0000,Ultiworldlive,White standing waiting for observers to rule on what should be the game.
523931993520996352,2014-10-19 20:21:36 +0000,Ultiworldlive,Hard cap is on.
523931891159007232,2014-10-19 20:21:11 +0000,Ultiworldlive,Fury turn it at mid field.
523931765464133634,2014-10-19 20:20:41 +0000,Ultiworldlive,Foul is overturned. Fury disc.
523931694865608704,2014-10-19 20:20:24 +0000,Ultiworldlive,Payne calls a foul as o'connor tries to find her on a high stall.
523931510685331456,2014-10-19 20:19:40 +0000,Ultiworldlive,O'Connor to pick up.
523931229859872769,2014-10-19 20:18:34 +0000,Ultiworldlive,Fury injury and the clock has stopped.
523930974024126465,2014-10-19 20:17:33 +0000,Ultiworldlive,These picks could be hurting Fury.
523930838908796928,2014-10-19 20:17:00 +0000,Ultiworldlive,Excellent D from Fury as time continues to tick away.
523930254793244673,2014-10-19 20:14:41 +0000,Ultiworldlive,5 minutes to hard cap.
523929935254396928,2014-10-19 20:13:25 +0000,Ultiworldlive,Howard puts it in to Narayan for Fury. Scandal 11-10 Fury.
523929789020000257,2014-10-19 20:12:50 +0000,Ultiworldlive,Travel called. Coming back for fury.
523929537877663744,2014-10-19 20:11:50 +0000,Ultiworldlive,Howard tries her luck and draws a foul.
523929322558877696,2014-10-19 20:10:59 +0000,Ultiworldlive,Foul called on the huck. It's uncontested and Romano will have it for Fury.
523928569819709440,2014-10-19 20:07:59 +0000,Ultiworldlive,Scandal hang on to break and we have a game to 13. Scandal 11-9 Fury.
523928190897889281,2014-10-19 20:06:29 +0000,Ultiworldlive,Opi being Opi. Horizontal D and an overruled foul call.
523927734805086209,2014-10-19 20:04:40 +0000,Ultiworldlive,Fury have a wide open chance and miss the end zone again.
523927507587072000,2014-10-19 20:03:46 +0000,Ultiworldlive,Payne with a throwaway.
523927048340115456,2014-10-19 20:01:57 +0000,Ultiworldlive,Mercier takes a timeout. Scandal are a few yards away from a crucial break. Fury need a big stand. #nationalsTX
523926760753479680,2014-10-19 20:00:48 +0000,Ultiworldlive,Ruden turfs it for Fury.
523926575772098560,2014-10-19 20:00:04 +0000,Ultiworldlive,Soft cap horn blows. We'll add 2 at the end of the point.
523926219214303232,2014-10-19 19:58:39 +0000,Ultiworldlive,O'Connor putting up a big floater to Jorgensen for a Scandal break. Scandal 10-9 Fury.
523925824823894018,2014-10-19 19:57:05 +0000,Ultiworldlive,&lt; 3 minutes until cap
523925519008792578,2014-10-19 19:55:52 +0000,Ultiworldlive,Opi bombs it to a steaking Daly. Scandal hold. Fury 9-9 Scandal.
523925165370265600,2014-10-19 19:54:28 +0000,Ultiworldlive,Turnover for scandal followed by one from Fury where they miss the endzone by a few feet. Scandal back with it.
523924249070014464,2014-10-19 19:50:49 +0000,Ultiworldlive,Opi out on offense for Scandal
523924014876880897,2014-10-19 19:49:53 +0000,Ultiworldlive,That's a Fury break. Two straight for them out of half. #nationalsTX
523923750753173504,2014-10-19 19:48:50 +0000,Ultiworldlive,Fury's Duffy with a big d to create a short field opportunity
523923397139791872,2014-10-19 19:47:26 +0000,Ultiworldlive,That is Fury's second completed huck this game.
523923301744517121,2014-10-19 19:47:03 +0000,Ultiworldlive,Snyder finds Chow for a Fury hold. Scandal 8-8 Fury
523922985418506241,2014-10-19 19:45:48 +0000,Ultiworldlive,Fury working on O to start this half.
523920261184487425,2014-10-19 19:34:58 +0000,Ultiworldlive,Opi breaks to White and breaks for half! Scandal leads fury 8-7. #NationalsTX
523920038513106944,2014-10-19 19:34:05 +0000,Ultiworldlive,"Sneider injured on the play for Fury, but walks off the field. A fury drop gives scandal a chance at a break."
523919394200879104,2014-10-19 19:31:32 +0000,Ultiworldlive,Mercier upline to O Conner for the 7-7 tie. Next point for half! #NationalsTX
523918387588911105,2014-10-19 19:27:32 +0000,Ultiworldlive,Fury holds on offense despite tight scandal defense. Desmond with a great throw to Ruden. Fury leads 7-6.
523918378033901568,2014-10-19 19:27:29 +0000,Ultiworldlive,RT @aint_so_bad: @USAUltimate @Ultiworldlive was #6 on scandal evaluated for a concussion after that knee to the head? #shouldbe
523917849396805633,2014-10-19 19:25:23 +0000,Ultiworldlive,"Fury over throws their receiver, and Scandal takes advantage with a Break! Opi with the score. Tied at 6-6."
523917014684160001,2014-10-19 19:22:04 +0000,Ultiworldlive,"Fury and Scandal exchange posessions, but DC shows a level head and puts it in on offense. 6-5 Fury leads."
523915555661971457,2014-10-19 19:16:17 +0000,Ultiworldlive,Fury with great cutting and the easy score. 6-4 SF over DC in the women's final. #NationalsTX
523914931604062208,2014-10-19 19:13:48 +0000,Ultiworldlive,Scandal gets the disc back on a deep d. Opi finds White for the offensive hold. DC still trails 5-4.
523913933045137408,2014-10-19 19:09:50 +0000,Ultiworldlive,Fury takes a time out with a break chance. They lead 5-3.
523913134520954882,2014-10-19 19:06:39 +0000,Ultiworldlive,Jorgensen with a huge end zone D for Fury. Fury gets a chance at their 3rd straight break.
523911901768851456,2014-10-19 19:01:45 +0000,Ultiworldlive,Duffy with D for Fury. They find Nazarov for their second straight break! SF up 5-3.
523911202691616770,2014-10-19 18:58:59 +0000,Ultiworldlive,The Fury zone forces a turn and a short field. The late stall hammer from Narayan leads to a fury break. 4-3 SF leads.
523910354741764097,2014-10-19 18:55:37 +0000,Ultiworldlive,Scandal very Poachy in their defense. Fury stagnant offensively. They eventually find Nazarov in the end zone for the offensive hold. 3's.
523909597447606272,2014-10-19 18:52:36 +0000,Ultiworldlive,"Opi hucks to Beach, to score the DC break! Beautiful throw. 3-2."
523908474598858754,2014-10-19 18:48:08 +0000,Ultiworldlive,"Patient O from DC, until a completed high stall huck from Johnston. Tied at 2's. #NationalsTX"
523907850780020736,2014-10-19 18:45:40 +0000,Ultiworldlive,Scandal turns and Snyder finds Fletcher for the Fury break. SF leads 2-1.
523907450362408960,2014-10-19 18:44:04 +0000,Ultiworldlive,"Scandal with their first turn of the game, and now SF has a chance to break. They try the huck but Johnston with the D for Scandal."
523906750102372352,2014-10-19 18:41:17 +0000,Ultiworldlive,6 turns this point total. Fury finds Lisa P in the end zone for the eventual hold. Scandal with three break chances that point. 1-1.
523905932347318272,2014-10-19 18:38:02 +0000,Ultiworldlive,Fury with the ill advised huck leading to the Scandal D. Scandal can't take advantage with the disc. SF back on O.
523905352262508544,2014-10-19 18:35:44 +0000,Ultiworldlive,SF Fury with the pull. Scandal with smooth offense and the hold. 1-0 start with DC on told. Mercier with the assist.
523890009288744960,2014-10-19 17:34:46 +0000,Ultiworldlive,And that's it! Drag N Thrust wins on a goal to Meckstroth. 15-9 final.
523889007097565185,2014-10-19 17:30:47 +0000,Ultiworldlive,Seattle gets their first break of the game on a deep shot to Dominic Cavalero. 14-9 DNT
523888199366901760,2014-10-19 17:27:34 +0000,Ultiworldlive,"After the timeout, five total turns by both teams until Bailey catches a nice huck from Burton. 14-8, DNT receiving for the win."
523887003344338944,2014-10-19 17:22:49 +0000,Ultiworldlive,"Seattle turns it, DNT calls a timeout. Need to work full field for the break."
523886421418213377,2014-10-19 17:20:30 +0000,Ultiworldlive,14-7 Drag N Thrust one point away
523885374247305216,2014-10-19 17:16:21 +0000,Ultiworldlive,"Cam Bailey with a huge scoober and Burton with the nice grab for the goal, but Seattle still behind 13-7."
523884452595113984,2014-10-19 17:12:41 +0000,Ultiworldlive,"Meckstroth to Clark for the goal. 13-6, DNT two points away from victory."
523883774816575488,2014-10-19 17:09:59 +0000,Ultiworldlive,Cameron Bailey with goal for Seattle. They trail DNT 12-6.
523882930243141632,2014-10-19 17:06:38 +0000,Ultiworldlive,Another easy o point for DNT and they lead 12-5
523882313927888896,2014-10-19 17:04:11 +0000,Ultiworldlive,Seattle scores. 11-5 Drag N Thrust leads.
523880793366872064,2014-10-19 16:58:09 +0000,Ultiworldlive,11-4 Drag N Thrust
523879996071612416,2014-10-19 16:54:58 +0000,Ultiworldlive,Drag N Thrust with another break. This one is turning into a blowout. Up 10-4 over Seattle
523879436803137536,2014-10-19 16:52:45 +0000,Ultiworldlive,9-5 DNT. They score easily out of half.
523877559520739328,2014-10-19 16:45:18 +0000,Ultiworldlive,"After turner by both teams, DNT holds. They lead at half 8-4 over Ghetto Birds"
523875673455476737,2014-10-19 16:37:48 +0000,Ultiworldlive,Ghetto Birds hold on offense. Johnson to Paul. 7-4 Drag N' Thrust up.
523874973015097344,2014-10-19 16:35:01 +0000,Ultiworldlive,"Burton can't hit Johnson deep. DNT capitalizes again on a huck to Brian Schoenrock for the break. DNT up 7-3, pulling for half."
523874244758093825,2014-10-19 16:32:07 +0000,Ultiworldlive,Silly throw by Cameron Bailey 5yds out of the end zone gives DNT the disc. They break in three throws. 6-3 Drag N Thrust leads.
523873223298260992,2014-10-19 16:28:04 +0000,Ultiworldlive,Uncontested foul in the end zone gives Drag N Thrust the goal. They're up 5-3
523872534442549248,2014-10-19 16:25:19 +0000,Ultiworldlive,Burton to Paul. 4-3 DNT
523872144913367040,2014-10-19 16:23:47 +0000,Ultiworldlive,DNT works it up the field and scores on an easy upline to Austin Lien for the 4-2 lead. drag n thrust is the better team so far.
523871373933170688,2014-10-19 16:20:43 +0000,Ultiworldlive,"Seattle gets the turn, but a bad throw to Khaleef in the end zone gives it right back to DNT."
523870762613366784,2014-10-19 16:18:17 +0000,Ultiworldlive,"Phil Paul of Ghetto catches a long throw right outside the end zone and calls a TO. Out of the timeout, easy goal to Burton. 3-2 DNT"
523869921982545920,2014-10-19 16:14:57 +0000,Ultiworldlive,"DNT with another break. Mike Petersen to Sarah Anciaux. 3-1 DNT, up two breaks early."
523869528112263168,2014-10-19 16:13:23 +0000,Ultiworldlive,Another throwaway from Seattle offense. DNT with the disc 20 yards out.
523869043263279105,2014-10-19 16:11:27 +0000,Ultiworldlive,Bad unforced throwaway off the pull from Seattle leads to a Drag N Thrust break. 2-1 DNT
523868604023193600,2014-10-19 16:09:42 +0000,Ultiworldlive,"After turns by both team, Austin Lien throws a monster full field bomb to James Hron for the Drag N Thrust goal. 1-1"
523868101809807360,2014-10-19 16:07:43 +0000,Ultiworldlive,"Ghetto Birds immediately huck deep to Mark Burton, who pulls it down and throws the short goal to Phil Paul. 1-0 Seattle"
523867509255323648,2014-10-19 16:05:21 +0000,Ultiworldlive,Mixed finals about to begin. Seattle receiving on offense.
523673095895543808,2014-10-19 03:12:50 +0000,Ultiworldlive,Gibson with 7 goals. Unreal.
523672877032546304,2014-10-19 03:11:57 +0000,Ultiworldlive,Farrell finishes a patient Bravo possession with an OI backhand to the back corner for Gibson. Bravo is headed to the final.
523671792641404930,2014-10-19 03:07:39 +0000,Ultiworldlive,"Double season point, folks."
523671738811695104,2014-10-19 03:07:26 +0000,Ultiworldlive,"GOAT works the other way and, after a Toly layout, score on Toly to Carroll."
523671196169420800,2014-10-19 03:05:17 +0000,Ultiworldlive,Observers say no foul.
523671047464583168,2014-10-19 03:04:41 +0000,Ultiworldlive,Mickle gets up and calls the foul. Crowd not a fan.
523670982532554752,2014-10-19 03:04:26 +0000,Ultiworldlive,Mickle upline and he and Hibbert both bid. Looks like a turn but Mickle lands on his shoulder. Injury timeout.
523670436916506624,2014-10-19 03:02:16 +0000,Ultiworldlive,Bravo TMF btw.
523670372961759232,2014-10-19 03:02:00 +0000,Ultiworldlive,Lindquist has been exceptional in this game. Extremely reliable.
523670231487901697,2014-10-19 03:01:27 +0000,Ultiworldlive,"Foord diving catch saves possession. Nice break throw to Lindquist who jumps it in. 13-12, Bravo can hold to win."
523669901379403777,2014-10-19 03:00:08 +0000,Ultiworldlive,"Bravo being very strategic. Junk to take GOAT out of pull play, heavy switching to contain deep cuts."
523669218085330944,2014-10-19 02:57:25 +0000,Ultiworldlive,"Patient Bravo D line offense weathers a few mistakes there and get a break. GOAT O has to be gassed. 13-11, Bravo."
523667788544872448,2014-10-19 02:51:44 +0000,Ultiworldlive,"Peterson can't put weight on it. Gibson comes in, Carroll for GOAT."
523667484965355520,2014-10-19 02:50:32 +0000,Ultiworldlive,"Lloyd with a close bid, Peterson goes down trying to dodge him after the catch. Injury stoppage."
523666954750816256,2014-10-19 02:48:25 +0000,Ultiworldlive,Lloyd with a huck to Harris but Harris looks away before the throw and finds it too late. Conker D.
523666687728840704,2014-10-19 02:47:22 +0000,Ultiworldlive,Observers say they didn't see it and send it back. Seen too many send backs today.
523666447651061760,2014-10-19 02:46:25 +0000,Ultiworldlive,Lindquist with a big flick huck to Harris. Petersen flies in for another highlight reel help D over the top. Foul call.
523666272819892224,2014-10-19 02:45:43 +0000,Ultiworldlive,Another back line pull from Bravo gives GOAT a long way to go.
523665906187399168,2014-10-19 02:44:15 +0000,Ultiworldlive,"A massive Brodie flick huck to Gibson hangs. Keegan catches the trash. 12-11, game to 14."
523665422810640384,2014-10-19 02:42:20 +0000,Ultiworldlive,"Stall 9 scoober from Lindquist finds Masek-Kelly on the break side. Total punt. GOAT goal. Nichols goal. 11-11, a minute till cap."
523664964398350336,2014-10-19 02:40:31 +0000,Ultiworldlive,"Jimmy freakin Mickle. Insane layout grab on a Watson huck. Dishes to Gibson for his 6th goal. ""Way to extend my range!"" cheers Watson."
523664108579979264,2014-10-19 02:37:07 +0000,Ultiworldlive,Easy Hibbert to Ojo red zone goal. What a way to give up the break. Back to 10s.
523663880531509248,2014-10-19 02:36:12 +0000,Ultiworldlive,Morgan loses the disc faking and catches it again. Ruled a turnover. Incredibly strange.
523663515954200578,2014-10-19 02:34:46 +0000,Ultiworldlive,"Lindquist hammer to Yearwood after Lloyd overshoots a huck and Lokke drops one short. 10-9, Bravo. GOAT lateral throws excellent."
523662597435166720,2014-10-19 02:31:07 +0000,Ultiworldlive,"Deep shot to Lloyd against Petersen is just a little too floaty. McShane deep to a leaping Conker for a huge break. 10-8, Bravo."
523661942393946112,2014-10-19 02:28:30 +0000,Ultiworldlive,"Yet another set of GOAT legs thrown at Mickle. A huge loopy flick to Gibson, his fifth goal. Incredible touch and vision on the throw. 9-8."
523661373084282880,2014-10-19 02:26:15 +0000,Ultiworldlive,Vasilyev to Martin with a hammer for the break. 8-8. Technical was for swearing.
523661047715336194,2014-10-19 02:24:57 +0000,Ultiworldlive,Powell with a big layout D attempt. Takes an injury. Bravo gets a third technical foul and GOAT gets premium field position.
523660103392952320,2014-10-19 02:21:12 +0000,Ultiworldlive,"GOAT with a series of push passes up the open side to score, Lindquist to McKnight. 8-7, Bravo leads."
523657161537114114,2014-10-19 02:09:31 +0000,Ultiworldlive,Huge break to take half! Bravo's Henry Konker with a great grab. 8-6
523653995177336832,2014-10-19 01:56:56 +0000,Ultiworldlive,We're gonna stop updating Twitter and do everything in liveblog: http://ultiworld.com/2014/10/18/ultiworlds-club-championships-liveblog-presented-savage-ultimate/
523653888176435200,2014-10-19 01:56:30 +0000,Ultiworldlive,GOAT gets the break! 5-5.
523653490757730305,2014-10-19 01:54:55 +0000,Ultiworldlive,Kloor throws it away on a dump miscommunication right at the doorstep. GOAT takes timeout.
523652827491467264,2014-10-19 01:52:17 +0000,Ultiworldlive,Lefty backhand from Justin Foord for the Thomson Mcknight score. 5-4 Bravo up a break
523650625519640576,2014-10-19 01:43:32 +0000,Ultiworldlive,RT @PrideofNY: What we dared dream has actually come true: Tim Morrissey's hair looks even better than it did at college nationals.
523650573279576064,2014-10-19 01:43:20 +0000,Ultiworldlive,Mark Lloyd dime huck to Karl Loiseau. 3-3
523649354481934337,2014-10-19 01:38:29 +0000,Ultiworldlive,Bravo huck is too far and GOAT gets it back
523649302866825216,2014-10-19 01:38:17 +0000,Ultiworldlive,GOAT huck is too far. Mark Lloyd tries for the greatest but it doesn't connect
523649065460842497,2014-10-19 01:37:20 +0000,Ultiworldlive,"Bravo holds to make it 3-2. Goat had a shot at a break after a nice D by Andrew Carroll, but they gave it right back"
523648218366636032,2014-10-19 01:33:58 +0000,Ultiworldlive,Goat ties it up. 2-2. Follow live on the liveblog: http://ultiworld.com/2014/10/18/ultiworlds-club-championships-liveblog-presented-savage-ultimate/
523647142632488960,2014-10-19 01:29:42 +0000,Ultiworldlive,Bravo up 2-1 on GOAT after three offensive holds. No turnovers yet.
523636081909317632,2014-10-19 00:45:45 +0000,Ultiworldlive,"IRONSIDE WINS. Amazing defensive effort from Ring tonight. A very exciting, but extremely call heavy game."
523635410661289984,2014-10-19 00:43:05 +0000,Ultiworldlive,Shane Sisco with the Ring takeaway
523634996410859520,2014-10-19 00:41:26 +0000,Ultiworldlive,Ring another impressive defensive stand. Ironside working.
523634482675744768,2014-10-19 00:39:23 +0000,Ultiworldlive,"She had hops, but the fences here at the FC Dallas complex are pretty tall. A for the run, C- for the dismount."
523634221303492609,2014-10-19 00:38:21 +0000,Ultiworldlive,And we're treated to a female streaker during this injury timeout.
523633521152520193,2014-10-19 00:35:34 +0000,Ultiworldlive,Muffin calls timeout.
523632814546501632,2014-10-19 00:32:46 +0000,Ultiworldlive,Nethercutt crushes cricket trying to make an upline. Injury called.
523632256762802176,2014-10-19 00:30:33 +0000,Ultiworldlive,Kapinos is hanging onto his Ironside teammates as they discuss the call. The throw is being sent back.
523632040219279360,2014-10-19 00:29:41 +0000,Ultiworldlive,Foul called after a ring huck gets tipped away by Ironside.
523630849678643200,2014-10-19 00:24:57 +0000,Ultiworldlive,Ironside turns it on the goal line. Ring with a chance.
523630302657540096,2014-10-19 00:22:47 +0000,Ultiworldlive,Ring take a timeout and send a few subs running along the sidelines getting the crowd to join them in booing Ring.
523629982757969920,2014-10-19 00:21:31 +0000,Ultiworldlive,Christian Johnson ROOFS it to send this game to DGP. 12-12
523629268061159424,2014-10-19 00:18:40 +0000,Ultiworldlive,Garcia to Clark and Ironside get their first point since 11-6. It is now Ironside 12-11 Ring.
523629016897835008,2014-10-19 00:17:40 +0000,Ultiworldlive,Great stand from Ring so far. Ironside still working
523628197947404288,2014-10-19 00:14:25 +0000,Ultiworldlive,Shane Sisco scores the BREAK. Tie ball game.
523627694765133824,2014-10-19 00:12:25 +0000,Ultiworldlive,"Stubbs and Babbitt both over from D line, but Stubbs throws it away."
523627485133807618,2014-10-19 00:11:35 +0000,Ultiworldlive,Noah Saul pulls it out of bounds for Ring.
