ID,Posted at,Screen name,Text
523522888159481857,2014-10-18 17:15:57 +0000,Ultiworldlive,"Klink with a dime to Drescher. 3-2, Drag'n."
523521832780328962,2014-10-18 17:11:46 +0000,Ultiworldlive,Both teams looking chill in the mild wind. Drag'n up 2-1. CLX receiving. Game on serve.
523294414744342528,2014-10-18 02:08:05 +0000,Ultiworldlive,"Mixed Pro Flight qualifiers: Blackbird and Mischief. Santa Maria will play AMP, and Bucket will play Slow White for the remaining two spots."
523294108484644864,2014-10-18 02:06:52 +0000,Ultiworldlive,"Women's Pro Flight qualifiers: Ozone and Showdown. Molly Brown will play Nightlock, and Schwa will play Traffic for the remaining two spots."
523293762739793920,2014-10-18 02:05:30 +0000,Ultiworldlive,"Men's Pro Flight qualifiers: Revolver and Rhino. Truck Stop will play Sockeye, and Doublewide will play Chain for the remaining two spots."
523241444853972992,2014-10-17 22:37:36 +0000,Ultiworldlive,RT @DickAndSauce: @FullFieldHammer @Ulti_world No regrets.
523222789424418816,2014-10-17 21:23:28 +0000,Ultiworldlive,Mixed semis: Seattle Mixed vs. Wild Card. Drag'N Thrust vs. CLX.
523210854213648384,2014-10-17 20:36:03 +0000,Ultiworldlive,"RT @FullFieldHammer: In other Nationals shockers, @Ulti_world reporter Tad Wissel throws his fire to win the cold Gatorade over the warm one."
523206337589964801,2014-10-17 20:18:06 +0000,Ultiworldlive,Exciting round of ultimate all around here in Frisco
523206212591316992,2014-10-17 20:17:36 +0000,Ultiworldlive,Johnny Bravo patiently works the disc for the winning score. 14-12 over truck stop.
523205219640172544,2014-10-17 20:13:39 +0000,Ultiworldlive,"Truck with the easy score, down 12-13 to Bravo, game to 14."
523205086055792641,2014-10-17 20:13:07 +0000,Ultiworldlive,Ring of Fire takes down Chain Lightning 12-10
523204761236307968,2014-10-17 20:11:50 +0000,Ultiworldlive,Bravo gets a turn and puts it in. Up 13-11 on Truck Stop
523204498647711744,2014-10-17 20:10:47 +0000,Ultiworldlive,"It's official. GOAT unseats overall #1 Revolver, 13-12."
523204246251241473,2014-10-17 20:09:47 +0000,Ultiworldlive,WHAT IS HAPPENING?! GOAT beats Revolver on universe point. The champs have been dethroned.
523203972660985856,2014-10-17 20:08:42 +0000,Ultiworldlive,"Crazy ultimate right now. GOAT and Revolver on universe, Chain v Ring close, Truck looking to send Bravo to universe"
523203289002020865,2014-10-17 20:05:59 +0000,Ultiworldlive,Bravo holding on to a narrow lead over Truck Stop. Up 12-11. Truck on O
523202930711998465,2014-10-17 20:04:33 +0000,Ultiworldlive,Howard with the final score. Fury topples Molly Brown in convincing 15-11 fashion. They'll play Riot in semis.
523202668987449345,2014-10-17 20:03:31 +0000,Ultiworldlive,To beat*
523202655397896192,2014-10-17 20:03:28 +0000,Ultiworldlive,"Boston breaks again, good patience. Hoffmann to Kim. Boston survives Showdown 16-14."
523202613014441984,2014-10-17 20:03:18 +0000,Ultiworldlive,"Brute Squad gets the break, scores 3 straight points tie beat Showdown 16-14. Tough loss for the Austin club."
523202539521835008,2014-10-17 20:03:00 +0000,Ultiworldlive,Prial finds Doi. Bravo 12-11 Truck. Game to 14.
523202445263253505,2014-10-17 20:02:38 +0000,Ultiworldlive,GOAT breaks back on Revolver. 12-11.
523202358252404737,2014-10-17 20:02:17 +0000,Ultiworldlive,Brute with total shut down D. Tajima handblocks the punt. Brute 5 yards out.
523202307543273473,2014-10-17 20:02:05 +0000,Ultiworldlive,Hand block for Brute Squad.
523202203247321088,2014-10-17 20:01:40 +0000,Ultiworldlive,Ring and Chain trade. 11-9 Raleigh
523202129985822720,2014-10-17 20:01:23 +0000,Ultiworldlive,Lambert with a disgusting layout grab to make it 14-11Fury. SF receiving.
523201924452343808,2014-10-17 20:00:34 +0000,Ultiworldlive,"Brute Squad gets the break, up 15-14 on Showdown."
523201854470389760,2014-10-17 20:00:17 +0000,Ultiworldlive,A few short throws after a great break from Tunnnell and Boston goes up 15-14 on Showdown.
523201389824983040,2014-10-17 19:58:26 +0000,Ultiworldlive,"Showdown almost drops the pull, and then throws it away. Brute with the disc, 15 yards out."
523201375086596096,2014-10-17 19:58:23 +0000,Ultiworldlive,Showdown nearly drops a second pull but Hammond catches the bobble. Tunnell run through D right away. Brute TO.
523201310716624896,2014-10-17 19:58:07 +0000,Ultiworldlive,Revolver breaks to take the lead on GOAT 11-10.
523201256244772864,2014-10-17 19:57:54 +0000,Ultiworldlive,Ring 10-8 Chain
523201043715592192,2014-10-17 19:57:04 +0000,Ultiworldlive,"14-14 between Brute Squad and Showdown, hard to 17."
523200925075505152,2014-10-17 19:56:35 +0000,Ultiworldlive,Riot close out 15-9 over Ozone.
523200777419243521,2014-10-17 19:56:00 +0000,Ultiworldlive,"Showdown and Brute Squad are tied at 14. Soft cap on, game to 16."
523200754224754688,2014-10-17 19:55:55 +0000,Ultiworldlive,"Clancy with a nice huck to Jorgenson. 14-10, Fury on the brink."
523200750630207488,2014-10-17 19:55:54 +0000,Ultiworldlive,"Brute holds against Showdowns junk, Ziperstein to Malinowski. 14-14"
523200424913141760,2014-10-17 19:54:36 +0000,Ultiworldlive,"Molly Brown hold on a long point. 13-10, Fury."
523200236366594048,2014-10-17 19:53:51 +0000,Ultiworldlive,Peter Prial throws a strike of a hammer to Doi in the back of the end zone. Bravo 11-10 truck
523200231627051008,2014-10-17 19:53:50 +0000,Ultiworldlive,Showdown up 14-13 pulling to Brute Squad.
523200176593600513,2014-10-17 19:53:37 +0000,Ultiworldlive,"Brute D grinding and Showdowns O looks tired, no good cuts...but they punt to the break side and Levinn yanks it down. 14-13, Showdown."
523199679107178496,2014-10-17 19:51:38 +0000,Ultiworldlive,Boston finishes with a break. Extremely impressive. 15-9 over Rhino
523199541328097281,2014-10-17 19:51:05 +0000,Ultiworldlive,Hunter Taylor gets the d and bookends for the break. Ring up 10-7
523199450521817088,2014-10-17 19:50:44 +0000,Ultiworldlive,"Showdown drops the pull. Tajima IO break to Groom to tie it. Brute freakin out, Showdown quiet."
523199192966397952,2014-10-17 19:49:42 +0000,Ultiworldlive,Revolver gets a break back. 9-9 with GOAT.
523198975470354432,2014-10-17 19:48:50 +0000,Ultiworldlive,Ring holds out of half. Up 9-7
523198944630038528,2014-10-17 19:48:43 +0000,Ultiworldlive,"Terrible huck from Rhino, Ironside looking to break for the win."
523198928708448260,2014-10-17 19:48:39 +0000,Ultiworldlive,"Molly Brown turn an upline. Fury work it, and Desmond comes down with a BEAST of a sky for the break. 13-9, SF pulling away."
523198871867248640,2014-10-17 19:48:26 +0000,Ultiworldlive,"Brute Squad just refusing to swing it until Seville hits Tunnell with an inside break. She throws a score. 13-12, Showdown. Brute TO."
523198541033111553,2014-10-17 19:47:07 +0000,Ultiworldlive,"Freechild drops the disc in the endzone, Stubbs throws a full field huck to Sherwood for the score. 14-9 Boston"
523198407847206913,2014-10-17 19:46:35 +0000,Ultiworldlive,Showdown with a deep poach and Shelton gets a block but give back the short field possession.
523198380194156544,2014-10-17 19:46:29 +0000,Ultiworldlive,"Riot crushing Ozone 14-8, looking to close out."
523198265530277888,2014-10-17 19:46:01 +0000,Ultiworldlive,"Fury break to take back the momentum. 12-9, SF up on Denver."
523198107950252032,2014-10-17 19:45:24 +0000,Ultiworldlive,"3 shots at a break and Truck finally get it. Bravo 10-9 Truck. Two technicals issued so far, one apiece to each team. #nationalsTX"
523197895605243904,2014-10-17 19:44:33 +0000,Ultiworldlive,"Showdown working against Brute zone and scores to keep a 13-11 lead, Harris to Forth."
523197582051667969,2014-10-17 19:43:18 +0000,Ultiworldlive,"Brute trying to avoid the shocking upset. 12-11, Showdown up and set to receive."
523197484584407040,2014-10-17 19:42:55 +0000,Ultiworldlive,"Connor Matthews layout D in the endzone for Rhino, but they turn it back. Beautiful hammer in the endzone to Danny Clark. 13-9 Ironside."
523197450476322816,2014-10-17 19:42:47 +0000,Ultiworldlive,"Fury stop the bleeding. 11-9, SF."
523197275297026048,2014-10-17 19:42:05 +0000,Ultiworldlive,Second chance after a Davis turf. Davison skies for a Traffic goal. 13-11.
523196930151972864,2014-10-17 19:40:43 +0000,Ultiworldlive,"Kira Frew with a beautiful fading huck to Davison, but dropped."
523196713755217920,2014-10-17 19:39:51 +0000,Ultiworldlive,"Fury miff two throws and Molly Brown capitalize. Denver on a 3-0 run. 10-9, SF."
523196559794917376,2014-10-17 19:39:15 +0000,Ultiworldlive,"First turn of the half from Ironside O, Rhino with a layout catch on a hammer in the endzone. 12-9 Boston"
523196399664377856,2014-10-17 19:38:36 +0000,Ultiworldlive,Traffic throwing a lot of jump ball hucks. Difficult plays. Scandal pressure doing a lot of work.
523196308522143744,2014-10-17 19:38:15 +0000,Ultiworldlive,Another Chain turn. Scoober to Tarasi to take half. Raleigh up 8-7 but have to be disappointed by their mistakes to let Chain close the gap.
523196230604967936,2014-10-17 19:37:56 +0000,Ultiworldlive,"Hucks to Jorgensen: good for Scandal, bad for Traffic. Scandal up 13-10 and Traffic is quiet."
523195997787525120,2014-10-17 19:37:01 +0000,Ultiworldlive,"Chastain with a MONSTER head-high layout D. Molly capitalize, finding Snodgrass for the break. 10-8, Fury."
523195867093016576,2014-10-17 19:36:29 +0000,Ultiworldlive,Rhino with a perfect huck. 12-8
523195826227904512,2014-10-17 19:36:20 +0000,Ultiworldlive,Truck O creates a turn to save a break and score. Bravo 10-8 Truck #nationalsTX
523195709156114432,2014-10-17 19:35:52 +0000,Ultiworldlive,Big Ring huck too long again. Wasting a lot of chances. Chain has a shot to break for half but turn it themselves. Then another Ring turn
523195451009277952,2014-10-17 19:34:50 +0000,Ultiworldlive,"Hatchett with big time layout block, Stubbs skies huge on a hammer and throws the score. Ironside taking it to Rhino 12-7"
523195329710391296,2014-10-17 19:34:21 +0000,Ultiworldlive,"Fury throw zone, but Molly Brown shred it. Cross comes down with a sweet grab to keep it close. 10-7, SF."
523195249666293760,2014-10-17 19:34:02 +0000,Ultiworldlive,Kwok drops an open huck but then gets a layout D. Then Hui drops a tough catch for the score.
523195153024946176,2014-10-17 19:33:39 +0000,Ultiworldlive,Goforth's long arms seem to robot extend. He snags a disc with casual ease on d for Chain and Clarke to Hollingworth to break. 7 all
523195031994511361,2014-10-17 19:33:10 +0000,Ultiworldlive,"RT @Boston_Ironside: Playing double score, crick finds boo for the tiptoe goal. 11-7 sailors"
523194939858239488,2014-10-17 19:32:48 +0000,Ultiworldlive,"And the game intensifies-Gibson draws three fouls on the mark from Moldenhauer, Keegan draws from Johnson, mickle scores. Bravo 10-7 Truck"
523194744323989504,2014-10-17 19:32:02 +0000,Ultiworldlive,"Mercier shorts a huck for a turn but gets it right back with a handblock. Tosses in a score to Daly. 12-10, scandal up on traffic."
523194666439942144,2014-10-17 19:31:43 +0000,Ultiworldlive,Mark Lloyd has 5 of GOAT's first half goals. GOAT up a break 8-7 on Revolver.
523194662618923008,2014-10-17 19:31:42 +0000,Ultiworldlive,"Long, grueling point, but Fury emerge on top once again. Jorgenson hits Duffy for the break. 10-6, SF up on Denver."
523194382829506561,2014-10-17 19:30:36 +0000,Ultiworldlive,Rhino's D can't get any stops. Ironside up 11-7.
523194250000072704,2014-10-17 19:30:04 +0000,Ultiworldlive,Riot break twice out of half. Seattle up 10-6.
523194133016760321,2014-10-17 19:29:36 +0000,Ultiworldlive,"Hui with a big curvy huck and Churchland gets it. 11-10, Scandal."
523194050405339136,2014-10-17 19:29:16 +0000,Ultiworldlive,Ring wastes another chance on a float pass and Chain quickly (and finally) scores. 7-6 Ring receiving and leading
523193812769071104,2014-10-17 19:28:20 +0000,Ultiworldlive,"Easy O for both teams. 10-7 Boston, receiving the disc."
523193664701734912,2014-10-17 19:27:44 +0000,Ultiworldlive,Traffic TO. Really need to collect themselves. Scandal's D line playing like they smell blood.
523193527136579584,2014-10-17 19:27:11 +0000,Ultiworldlive,Chain crossfield hammer turn. Third Ring chance to break for half
523193515099299841,2014-10-17 19:27:09 +0000,Ultiworldlive,"Mason drops and Beach goes deep on her early. Scandal up 11-9 on Traffic, on a 6-1 run."
523193301252710400,2014-10-17 19:26:18 +0000,Ultiworldlive,Traffic doesn't even catch the pull. Clearly rattled. Nearly throw another callahan. Get the sense this point could make or break them.
523193045894696960,2014-10-17 19:25:17 +0000,Ultiworldlive,"Asa Wilson throws to Conger for the goal, but goes back on travel"
523192868702535680,2014-10-17 19:24:35 +0000,Ultiworldlive,"OPI PAYNE CALLAHAN. Scandal goes ballistic. 10-9, Scandal up for first time since 1-0."
523192815778791424,2014-10-17 19:24:22 +0000,Ultiworldlive,Pitcaithley money huck to Finney. Fury up 9-6.
523192654210027520,2014-10-17 19:23:43 +0000,Ultiworldlive,Scandal starting to poach more. Defenders all watching the disc unless their cutter engages.
523192542696079360,2014-10-17 19:23:17 +0000,Ultiworldlive,Freechild every other. Rhino scored. 9-6
523192452471980032,2014-10-17 19:22:55 +0000,Ultiworldlive,Timeout Chain at midfield
523192278551392257,2014-10-17 19:22:14 +0000,Ultiworldlive,"Overthrow on the goal line for Fury. Molly Brown complete a huck to Boyle for the break out of half. 8-6, SF."
523192220548354048,2014-10-17 19:22:00 +0000,Ultiworldlive,Stubbs layout D leads to an easy break for Ironside. 9-5
523191993275789312,2014-10-17 19:21:06 +0000,Ultiworldlive,Daly sneaks in an OI flick upline to O'Connor for the toe in. 9s.
523191967522385921,2014-10-17 19:21:00 +0000,Ultiworldlive,Hunter Taylor with another sick layout d to save a goal but Ring wastes another big break chance with a long huck
523191660562636800,2014-10-17 19:19:46 +0000,Ultiworldlive,GOAT gets two turns. Calls a timeout at midfield. Only they don't have any. Turnover. Revolver hucks to Beau. 6-6. GOAT up a break.
523191558603276288,2014-10-17 19:19:22 +0000,Ultiworldlive,"Traffic finally scores on a deep shot to Davison. The world prays we see her against Jorgensen.  9-8, Traffic."
523191433931812864,2014-10-17 19:18:52 +0000,Ultiworldlive,Chain huck. Big Mark Evans d in the air in the endzone. Ring works it down the field but can't punch it in. Chain's Inselmann on d
523191335508254720,2014-10-17 19:18:29 +0000,Ultiworldlive,Showdown takes an 8-7 half on Brute. Can texas pull another improbable run to semis? This one the most unbelievable yet.
523191232307421185,2014-10-17 19:18:04 +0000,Ultiworldlive,Rhino to receive to start the second half.
523191187952648194,2014-10-17 19:17:54 +0000,Ultiworldlive,Correction: Riot up 8-6.
523190945421213696,2014-10-17 19:16:56 +0000,Ultiworldlive,"Traffic trying to split stack but look really confused. Two pretty terrible turnovers. Scandal easy short field break. 8-8, Traffic reeling"
523190914672783360,2014-10-17 19:16:49 +0000,Ultiworldlive,Riot clean it up and take half 8-5 on Ozone. Atlanta to receive out of the break.
523190582793863168,2014-10-17 19:15:30 +0000,Ultiworldlive,Time out Raleigh. Looking to load up a hybrid line to break for half
523190433480851456,2014-10-17 19:14:54 +0000,Ultiworldlive,Ring shoots deep to Christian Johnson. Nethercutt assist. UNC dark side connection hot for them. Ring up 7-5
523190433208225792,2014-10-17 19:14:54 +0000,Ultiworldlive,RT @cltxult: @TripleCrownTour: Mixed quarterfinal: @dragNthrust & @Blackbird_SF are tied at 6-6. #NationalsTX cc: @Ultiworldlive
523190261166637056,2014-10-17 19:14:13 +0000,Ultiworldlive,"Opi with a high huck to Jorgensen. Whitehead is at a huge disadvantage in the air. Jorgensen skies for it. 8-7, Traffic."
523190119788847104,2014-10-17 19:13:39 +0000,Ultiworldlive,"Ben Deiter drops a Ring pass and Chain has a chance to get a break back, but they turn it near their endzone"
523189930835857408,2014-10-17 19:12:54 +0000,Ultiworldlive,Total jump ball to Jorgensen but Whitehead fights her off.
523189874284052480,2014-10-17 19:12:41 +0000,Ultiworldlive,Applegate overthrows a swing. Jorgenson with a sick toe in the back of the endzone. Fury go on a 4-0 run to take half 8-5. They'll receive.
523189762489085952,2014-10-17 19:12:14 +0000,Ultiworldlive,Huck to Whitehead is gobbled up by Jorgensen. She's asserting herself.
523189636818935808,2014-10-17 19:11:44 +0000,Ultiworldlive,Spiva to Liu after a few Ring bids for Chain hold. Raleigh up 6-5 receiving
523189284325830657,2014-10-17 19:10:20 +0000,Ultiworldlive,Scandal D comin out jacked out of half. Applying a ton of pressure. Mercier to Sandy to Beach for a break. Volume up. 8-6.
523189198594252800,2014-10-17 19:09:59 +0000,Ultiworldlive,Boston takes half 8-5 over Portland Rhino
523189107531743232,2014-10-17 19:09:38 +0000,Ultiworldlive,"Boston's suffocating D forces a stall 9 hammer. Stubbs party ball to the endzone, where three Ironside players catch it simultaneously."
523188648087650304,2014-10-17 19:07:48 +0000,Ultiworldlive,Ozone giving Riot a run. 6s.
523188552725954560,2014-10-17 19:07:26 +0000,Ultiworldlive,"Overthrow leads to another Fury break on a dirty I-O from Ruden. 7-5, SF in control."
523188317274136577,2014-10-17 19:06:29 +0000,Ultiworldlive,Ring of Fire breaks. Bode to Sisco. Ring up 6-4
523188187104313344,2014-10-17 19:05:58 +0000,Ultiworldlive,"Wooten with a big huck to the break side for Walker. Break ties it up, 6-6."
523187958263054337,2014-10-17 19:05:04 +0000,Ultiworldlive,"Fury break on a long point. 6-5, SF."
523187892848693248,2014-10-17 19:04:48 +0000,Ultiworldlive,Rhino takes the point off. Danny Clark scores again in three throws. 7-5 Boston
523187669879123968,2014-10-17 19:03:55 +0000,Ultiworldlive,Big Chain hammer but great layout D in the endzone by rookie Hunter Taylor. He was making big plays this morning against Machine as well.
523187571170762752,2014-10-17 19:03:31 +0000,Ultiworldlive,"Boston forces a turn, but can't convert. Freechild takes over and Rhino punches it in. 6-5 Ironside"
523187379449126912,2014-10-17 19:02:46 +0000,Ultiworldlive,Ozone scores to make it 6-5 against Riot.
523187204475338752,2014-10-17 19:02:04 +0000,Ultiworldlive,Remy Ojo just recreated the YouTube D... only better. Then gets bookends. 5-4 as GOAT breaks Revolver for a third straight time.
523187173454274561,2014-10-17 19:01:57 +0000,Ultiworldlive,Bravo O answer. Gibson sends it deep for Mickle who hops over the line for the score. Bravo 7-4 Truck #nationalsTX
523186817945059328,2014-10-17 19:00:32 +0000,Ultiworldlive,Markham Shofner just roofed Tim Morissy for a score. Bravo 6-4 Truck
523186788047650816,2014-10-17 19:00:25 +0000,Ultiworldlive,Layout d from Ring. Taylor Pope picks up and throws to Noah Saul for the break. Ring 5- Chain 4. Timeout Atlanta
523186471436824576,2014-10-17 18:59:09 +0000,Ultiworldlive,"White misses an under flick for the Scandal turn. Moens catches a floaty huck over Roy for half. 8-5, Traffic over Scandal"
523186351668465664,2014-10-17 18:58:41 +0000,Ultiworldlive,Riot sidelines are killing it right now. Seattle acting like a team that's real hungry to crush.
523186296790212608,2014-10-17 18:58:28 +0000,Ultiworldlive,Boston O crisp. Works it up the field for an easy score. Danny Clark open all day. 6-4
523186263709741056,2014-10-17 18:58:20 +0000,Ultiworldlive,GOAT breaks twice in a row to get back on serve with Revolver. 4-4.
523186231342268416,2014-10-17 18:58:12 +0000,Ultiworldlive,Truck take a time out after the offense gets the disc back. Bravo 6-3 Truck
523186227131219968,2014-10-17 18:58:11 +0000,Ultiworldlive,Fury keep the disc moving and punch it in clean on the goal line. 5s.
523186022318755840,2014-10-17 18:57:22 +0000,Ultiworldlive,One long huck turn from each team before Dennis Tarasi puts up a nice deep shot to Christian Johnson for Ring goal. 4 all on sere
523185675806707712,2014-10-17 18:56:00 +0000,Ultiworldlive,"Kinda lackadaisical pull defense from Scandal. Moens boosts a big backhand to a streaking Davison. 7-5, Traffic. scandal TO."
523185642696880129,2014-10-17 18:55:52 +0000,Ultiworldlive,"Nice poach defense leads to a sweet O-I looper from Matthews to Chen. Molly Brown break to put it back on serve. 5-4, Denver."
523185549595922432,2014-10-17 18:55:30 +0000,Ultiworldlive,"Allison-Hall torches Babbitt, Rhino with the score. 5-4 Ironside"
523185360562823168,2014-10-17 18:54:44 +0000,Ultiworldlive,Riot up 5-3 on Ozone
523185260121423872,2014-10-17 18:54:20 +0000,Ultiworldlive,Correction 4-3 Chain up on serve
523185232040972288,2014-10-17 18:54:14 +0000,Ultiworldlive,"Mason turfs one and Sandy immediately takes her deep. Shows off the wheels, gets position and gets up. 6-5, Traffic."
523185054168530945,2014-10-17 18:53:31 +0000,Ultiworldlive,"Multiple turn point in Ring v Chain, Trenton Spinks runs down the long huck from ATL and snags the break. 4-4 on serve"
523185048778846208,2014-10-17 18:53:30 +0000,Ultiworldlive,Danny Clark with the hand block and eventual score. 5-3 Boston over Portland.
523185038478041088,2014-10-17 18:53:28 +0000,Ultiworldlive,Brute and Showdown locked at 4-4.
523184741697466369,2014-10-17 18:52:17 +0000,Ultiworldlive,Jorgensen to McClellan after Scandal gets it back. Scandal down 6-4 to Traffic with a hole to climb out of.
523184560973287424,2014-10-17 18:51:34 +0000,Ultiworldlive,Krutsinger with a clean I-O to Waugh. Molly Brown looking pretty smooth themselves. 4s.
523184515490275328,2014-10-17 18:51:23 +0000,Ultiworldlive,"Another turn from Ironside O, this time on Rhino's goal line."
523184406169919488,2014-10-17 18:50:57 +0000,Ultiworldlive,Opi and Sandy in on O. Huck to Sandy eaten by Hui. Turn and Hui gets another D.
523184016527073281,2014-10-17 18:49:24 +0000,Ultiworldlive,"Chain slices up the field. Spiva to Taylor for the easy goal. 3 all, Ring up a break and getting the ball"
523183973670092801,2014-10-17 18:49:14 +0000,Ultiworldlive,Crucial drop from Kolick on the first pass gives Bravo the disc on the goal line. Lance to Morrissy for the score. Bravo 5-2 Truck
523183902333362177,2014-10-17 18:48:57 +0000,Ultiworldlive,Nazarov with a money put to LaRoche. Fury up 4-3 on Molly Brown. SF is looking like classic Fury: dominant.
523183873522683905,2014-10-17 18:48:50 +0000,Ultiworldlive,"Mason catches a huck and then eventually catches the score. 6-3, Traffic."
523183753787895810,2014-10-17 18:48:21 +0000,Ultiworldlive,"Unforced error from Ironside on their own goal line, Rhino puts in the easy break. 3-4 Ironside."
523183638834585600,2014-10-17 18:47:54 +0000,Ultiworldlive,Whitehead now on White. Sick double layout. Coverage sack. Traffic working on another break.
523183378359930881,2014-10-17 18:46:52 +0000,Ultiworldlive,Brute down 3-2 to Showdown.
523183366259359744,2014-10-17 18:46:49 +0000,Ultiworldlive,Truck concede the first break after a Kolick throwaway. Bravo 4-2 Truck
523183347606908928,2014-10-17 18:46:45 +0000,Ultiworldlive,Big layout from Inselmann and Chain throws and go's to the endzone but a drop leads to a huck and score. Ring breaks up 3-2
523183284076183553,2014-10-17 18:46:29 +0000,Ultiworldlive,Molly Brown navigate a poachy junk set. Lambert with the nice go-to on a floater. 3s.
523183242443505664,2014-10-17 18:46:19 +0000,Ultiworldlive,"Nice O from Rhino, 4-2 Ironside."
523183029859418112,2014-10-17 18:45:29 +0000,Ultiworldlive,"Kwok with a diving toe in to hold. 5-3, Traffic."
523182799923453952,2014-10-17 18:44:34 +0000,Ultiworldlive,Kawai with a big sky like it's nothing. Riot up 3-2 on Ozone.
523182775730315264,2014-10-17 18:44:28 +0000,Ultiworldlive,Chain turn on long swing play but Asa Wilson gets a d to get it back. Chain hucks but Noah Saul gets a block. Another break chance. Timeout
523182550748233729,2014-10-17 18:43:35 +0000,Ultiworldlive,"Boston patient offense, converts the break. 4-1 Ironside. Defense is suffocating."
523182520536694784,2014-10-17 18:43:27 +0000,Ultiworldlive,"Jorgensen comes in for O and they instantly huck to her against Mason. Sandy wins, dishes for the score. 4-3, Traffic."
523182499477082112,2014-10-17 18:43:22 +0000,Ultiworldlive,"CRAZY head-high layout D by Nazarov. Fury work it up, and Desmond finds Duffy with an I-O for the break. 3-2, Fury."
523182390395826178,2014-10-17 18:42:56 +0000,Ultiworldlive,Revolver completes crazy greatest to Zach Travis for a break and 3-0 Revolver lead. They're all over GOAT right now.
523182352500260864,2014-10-17 18:42:47 +0000,Ultiworldlive,"Good dump D and Ning intercepts a reset for a near Callahan. Dishes for another break. 4-2, Traffic."
523182237349851138,2014-10-17 18:42:20 +0000,Ultiworldlive,Jeff Babbitt with a MONSTER  layout block in the endzone.
523181863134064640,2014-10-17 18:40:51 +0000,Ultiworldlive,"Rhino turns the disc, Stubbs hucks to Russell Walleck for a Boston break. 3-1 Ironside."
523181621961576448,2014-10-17 18:39:53 +0000,Ultiworldlive,"Kwok upline to Berezan for a hold. Opi fired up. 3-2, Traffic."
523181619532664833,2014-10-17 18:39:53 +0000,Ultiworldlive,Micah Hood deep shot to Josh Norris to hold. 2-2 on serve. Chain receiving
523181596489572352,2014-10-17 18:39:47 +0000,Ultiworldlive,"Desmond with a ridiculous grab. Tied at 2s, Molly receiving."
523181449776619520,2014-10-17 18:39:12 +0000,Ultiworldlive,Chain gets chance to break but hucks it away. Ring with the disc
523181399436963840,2014-10-17 18:39:00 +0000,Ultiworldlive,Showdown starts up 2-0 on #1 seed Brute Squad. They are one of two teams at nationals to beat Boston this year.
523181272193966080,2014-10-17 18:38:30 +0000,Ultiworldlive,Chain up on Ring of Fire 2-1
523181113209274368,2014-10-17 18:37:52 +0000,Ultiworldlive,"Mercier deep shot finds White with miles of separation. Mason not on that point. 2-2, Scandal down a break to Traffic."
523181009995845636,2014-10-17 18:37:27 +0000,Ultiworldlive,Snodgrass is tearing it up. Molly Brown up 2-1 on Fury.
